 Colorado; Iowa; Kansas; Minnesota; Missouri; Nebraska; Oklahoma; South Dakota provinces
 Texas; Delaware; Connecticut; Georgia; Louisiana; Massachusetts; Maine; Maryland; Mississippi; New Hampshire; New Jersey; New York; North Carolina; Pennsylvania; Rhode Island; South Carolina; Vermont; Virginia provinces
 Arkansas; Iowa; Texas
 Iowa; Kansas; Minnesota; Texas; Wisconsin provinces
 California; Georgia; Maryland provinces
 California; Nevada; Oregon provinces
 Tennessee; Arkansas; Kentucky; Mississippi; Alabama; Indiana; Texas; Illinois; Ohio; Missouri provinces
 Wells city (Elko district; Nevada province)
 Fulton; DeKalb; Cobb; Clayton; Gwinnett districts (Georgia province)
 Missouri; Mississippi; Arkansas; Indiana; Illinois; Ohio; Kentucky; Oklahoma; Iowa; Wisconsin; Texas provinces
 Pennsylvania
 Kansas; Maryland; Missouri; North Carolina; Virginia; Texas; Oklahoma; Georgia; Arkansas provinces
 Dunkerton city (Black Hawk district; Iowa province); Parkesburg; New Hartford cities (Butler district; Iowa province); Cedar Rapids city (Linn district; Iowa province); Minnesota; Indiana; Illinois; Kansas; Michigan; Montana; Missouri; Nebraska; Wisconsin provinces
 California province
 Panama city beach (Bay district; Florida province); Aransas; Bexar; Brooks; Calhoun; Cameron; Hidalgo; Jim Wells; Kenedy; Kleberg; Nueces; Refugio; San Patricio; Starr; Victoria; Willacy districts (Texas province)
 Texas
 Florida; Georgia; Alabama; Mississippi provinces
 Louisiana; Mississippi; Texas; Alabama provinces
 Utah
 Florida; North Carolina; Maryland provinces
 Galveston; Brazoria; Harris; Chambers; Jefferson districts (Texas province); Louisiana; Tennessee; Arkansas; Ohio; Indiana; Illinois; Missouri; Kentucky; Pennsylvania; Michigan provinces
 Chatsworth (near Los Angeles)
 Near Williams (California)
 Los Angeles; Orange; Riverside; Santa Barbara districts (California province)
 Maine; Massachusetts; New Hampshire; New York; Vermont provinces
 Arkansas; Illinois; Indiana; Kentucky; Missouri; New York; Ohio; Tennessee; Alabama; Mississippi provinces
 Arkansas; California; Colorado; Illinois; Indiana; Kansas; Michigan; Missouri; New York; Ohio; Oklahoma; Oregon; Washington; Wisconsin provinces
 Arkansas; Oklahoma; Texas provinces
 Illinois; Iowa; Kansas; Michigan; Minnesota; Missouri; Nebraska; Wisconsin provinces
 Orting town (Pierce district; Washington province); Chehalus town (Lewis district; Washington); Oregon province
 Suffolk district (Virginia province)
 Massachusetts; New York; Maine; New Hampshire; Vermont provinces
 Georgia; Savannah; Port Wentworth
 Texas; Pennsylvania; Oklahoma; Kentucky; Missouri; Arkansas; District of Columbia provinces
 Clarence Center (New york State)
 North Dakota; Minnesota provinces
 Butte (Montana)
 Texas; Oklahoma; Arkansas; Alabama; Georgia; Kentucky; Louisiana; Missouri; South Carolina; Tennessee provinces
 Santa Barbara district (California province)
 Near Floroda coast
 Virginia; Kentucky provinces
 Florida province
 Dallas; Tarrant; Harris; Galveston; Swisher districts (Texas province)
 Ohio; Oklahoma; Kentucky; Texas; Tennessee; Pennsylvania; West Virginia; Maryland; Washington provinces
 Maine province
 Los Angeles; Monterey districts (California province)
 Douglas; Floyd; Carroll; Fulton; DeKalb; Cobb; Clayton; Gwinnett districts (Georgia province); Alabama; North Carolina;Tennessee provinces
 Kent; Sussex districts (Delaware province); Atlantic; Burlington; Cape May; Cumberland; Monmouth; Ocean districts (New Jersey province); Virginia; New York; North Carolina; Pennsylvannia provinces
 Alabama; North Carolina; South Dakota; Pennsylvania; Texas; Oklahoma provinces
 Texas; Nebraska; Oklahoma; Kansas; North Carolina; Alabama; Missouri; Arkansas; Pennsylvania; Tennessee; Mississippi; South Carolina; Kentucky provinces
 Denver; Wheat Ridge; Lakewood; Arvada areas (Denver district; Colorado province)
 Illinois; Missouri provinces
 Texas; Missouri; Louisiana provinces
 Ferndale; Eureka cities (Humboldt district; California province)
 New Jersey; Pennsylvania; Maryland; North Carolina; Delaware; District of Columbia; Virginia provinces
 New York; District of Columbia; New Jersey; Pennsylvania; New Hampshire; Massachusetts; Maine; Connecticut; Rhode Island; Vermont provinces
 Montcoal (West Virginia)
 Rhode Island province
 Yazoo district (Mississippi province); Alabama; Louisiana; Arkansas; Georgia; Tennessee provinces
 Mexico Gulf
 Alabama; Arkansas; Mississippi; Kentucky; Tennessee provinces
 Oklahoma province
 Texas
 Arkansas; Oklahoma provinces
 North Carolina; Virginia; Maryland; Massachusetts; Rhode Island provinces
 San Bruno (California)
 Texas province
 Connecticut; Massachusetts; New Hampshire; New Jersey; New York; Pennsylvania; Rhode Island provinces
 Kern; Orange; Riverside; San Bernardino; San Luis Obispo; Tulare districts (California province); Utah; Nevada; Arizona provinces
 Boston city (Suffolk district; Massachusetts province); Philadelphia district (Pennsylvania province); Fulton; DeKalb; Cobb; Clayton; Gwinnett districts (Georgia province); New York; North Carolina; Delaware; Maryland; Rhode Island; Virginia provinces
 Arkansas; Missouri; Illinois provinces
 Illinois; Indiana; Iowa; Kansas; Michigan; Minnesota; Missouri; Montana; Nebraska provinces
 Colorado; Georgia; Illinois; Kansas; North Carolina; New Mexico; Oklahoma; South Carolina provinces
 Oklahoma; Texas; Missouri; Wisconsin; Minnesota; Colorado; Wyoming; Alabama; Arkansas; Delaware; Florida; Georgia; Kentucky; Louisiana; Maryland; Mississippi; North Carolina; South Carolina; Tennessee; Virginia; West Virginia; New York; New Jersey; Pennsylvania provinces
 New York
 Mississippi; Alabama; Oklahoma; Texas; North Carolina; Kansas provinces
 Texas province
 Alabama; Arkansas; Kentucky; Mississippi; Missouri; Tennessee; Oklahoma provinces
 Illinois; Missouri; Kentucky; Tennessee; Mississppi provinces
 Jasper; Newton districts (Missouri province)
 Missouri; Kansas; Texas provinces
 Illinois; Massachusetts; Michigan; Minnesota; North Dakota provinces
 New York; Washington; Texas; Ohio; Maine; Iowa; Illinois; Minnesota; Nebraska; Wisconsin; South Dakota provinces
 New York; New Jersey; Pennsylvania; North Carolina; Virginia; Maryland; District of Columbia; Connecticut; Florida provinces
 Bastrop district (Texas province)
 Reno (Nevada)
 Charlotte town (Mecklenburg district; North Carolina province)
 New York; New Jersey; Connecticut; Massachusetts provinces
 Louisiana; Mississippi; Alabama; Texas; New York; Pennsylvania; District of Columbia; Georgia; Maryland; Tennessee; Virginia provinces
 Colorado; New Mexico provinces
 Illinois; Indiana; Iowa; Kansas; Michigan; Minnesota; Missouri; Nebraska; North Dakota; Ohio; South Dakota; Wisconsin; Alabama; Arkansas; Delaware; Florida; Georgia; Kentucky; Louisiana; Maryland; Mississippi; North Carolina; South Carolina; Tennessee; Virginia; West Virginia; Maine; New Hampshire; Vermont; Massachusetts; Rhode Island; Connecticut; New York; New Jersey; Pennsylvania provinces
 Colorado; Kansas; Montana; Nebraska; New Mexico; North Dakota; Oklahoma; South Dakota; Texas; Wyoming; Illinois; Indiana; Iowa; Michigan; Minnesota; Missouri; Nebraska; North Dakota; Ohio; South Dakota; Wisconsin; Maine; New Hampshire; Vermont; Massachusetts; Rhode Island; Connecticut; New York; New Jersey; Pennsylvania; Tennessee provinces
 Illinois; Indiana; Iowa; Kansas; Michigan; Minnesota; Missouri; Nebraska; North Dakota; Ohio; South Dakota; Wisconsin; Alabama; Arkansas; Delaware; Florida; Georgia; Kentucky; Louisiana; Maryland; Mississippi; North Carolina; South Carolina; Tennessee; Virginia; West Virginia; Colorado; Kansas; Montana; Nebraska; New Mexico; North Dakota; Oklahoma; South Dakota; Texas; Wyoming provinces
 Mississippi; Ohio provinces
 Illinois; Indiana; Iowa; Kansas; Michigan; Minnesota; Missouri; Nebraska; North Dakota; Ohio; South Dakota; Wisconsin; New York; New Jersey; Pennsylvania provinces
 Arizona; Minnesota; Texas; Florida provinces
 Montana; North Dakota; South Dakota; Iowa; Missouri provinces
 Texas; Oklahoma; New Mexico; Arizona; Kansas; Louisiana provinces
 Jefferson; Chilton districts (Alabama province)
 Nebraska; Kansas; Missouri; Illinois; Indiana; Kentucky provinces
 Alabama; Tennessee; Illinois; Kentucky; Indiana; Ohio; Georgia; Florida; Mississippi; North Carolina; Virginia provinces
 Dallas; Tarrant districts (Texas province)
 Oklahoma; Kansas; Iowa; Nebraska; South Dakota; Minnesota provinces
 Bay; Calhoun; Escambia; Franklin; Gadsden; Gulf; Holmes; Jackson; Jefferson; Leon; Liberty; Madison; Okaloosa; Santa Rosa; Taylor; Wakulla; Walton; Washington; Brevard; Citrus; Hardee; Hernando; Hillsborough; Indian River; Lake; Manatee; Marion; Orange; Osceola; Pasco; Pinellas; Polk; Seminole; Sumter; Volusia districts
 Bay; Calhoun; Escambia; Franklin; Gadsden; Gulf; Holmes; Jackson; Jefferson; Leon; Liberty; Madison; Okaloosa; Santa Rosa; Taylor; Wakulla; Walton; Washington districts (Florida province); Alabama; Mississippi; Louisiana provinces
 District of Columbia; Iowa; Virginia; North Carolina provinces
 Colorado Springs city (El Paso district; Colorado province)
 District of Columbia province
 Mississippi; Louisiana provinces
 New York; New Jersey; Pennsylvania; Connecticut; Ohio; Delaware; Rhode Island; Maryland; Massachusetts; Maine; New Hampshire; North Carolina; Vermont; Virginia; District of Columbia; West Virginia provinces
 Wisconsin; Iowa; Nebraska; Kansas provinces
 Texas; Louisiana; Alabama; Mississippi; Arkansas; Indiana; Pennsylvania; Virginia; New York; New Jersey provinces
 Ohio; Virginia; Maryland; West Virginia; District of Columbia; Illinois; Indiana; Kentucky; New Jersey; North Carolina; South Carolina provinces
 Cleveland; Creek; Oklahoma; Payne districts (Oklahoma province)
 Missouri; Illinois; Kentucky; Texas; Indiana provinces
 Oregon; Washington provinces
 Oklahoma; Kansas; Minnesota; Texas; Pennsylvania; New York provinces
 Colorado; Wyoming provinces
 Texas; New Mexico provinces
 Ohio; Minnesota; Pennsylvania; Michigan; Wisconsin provinces
 Missouri; Pennsylvania; Virginia; Arkansas; Oklahoma; Maryland; New York provinces
 Illinois; Indiana; Iowa; Kansas; Michigan; Minnesota; Missouri; Nebraska; North Dakota; Ohio; South Dakota; Wisconsin provinces
 Illinois; Indiana; Iowa; Kansas; Michigan; Minnesota; Missouri; Nebraska; North Dakota; Ohio; South Dakota; Wisconsin; Arizona; California; Colorado; Nevada; New Mexico; Oklahoma; Texas; Utah provinces
 Alabama; Arkansas; Delaware; Florida; Georgia; Kentucky; Louisiana; Maryland; Mississippi; North Carolina; South Carolina; Tennessee; Virginia; West Virginia; Illinois; Indiana; Iowa; Kansas; Michigan; Minnesota; Missouri; Nebraska; North Dakota; Ohio; South Dakota; Wisconsin; Colorado; Kansas; Montana; New Mexico; Oklahoma; Texas; Wyoming provinces
 Maine; New Hampshire; Vermont; Massachusetts; Rhode Island; Connecticut; New York; New Jersey; Pennsylvania provinces
 South Dakota; North Dakota; Nebraska; Minnesota; Alabama; Illinois; Indiana; Iowa; Kansas; Michigan; Minnesota; Missouri; Nebraska; North Dakota; Ohio; South Dakota; Wisconsin; Alabama; Arkansas; Delaware; Florida; Georgia; Kentucky; Louisiana; Maryland; Mississippi; North Carolina; South Carolina; Tennessee; Virginia; West Virginia provinces
 California; Colorado; Kansas; Montana; Nebraska; New Mexico; North Dakota; Oklahoma; South Dakota; Texas; Wyoming; Illinois; Indiana; Iowa; Kansas; Michigan; Minnesota; Missouri; Nebraska; North Dakota; Ohio; South Dakota; Wisconsin; Alabama; Arkansas; Delaware; Florida; Georgia; Kentucky; Louisiana; Maryland; Mississippi; North Carolina; South Carolina; Tennessee; Virginia; West Virginia provinces
 Colorado; Kansas; Montana; Nebraska; New Mexico; North Dakota; Oklahoma; South Dakota; Texas; Wyoming; Illinois; Indiana; Iowa; Michigan; Minnesota; Missouri; Nebraska; North Dakota; Ohio; South Dakota; Wisconsin provinces
 Maine; New Hampshire; Vermont; Massachusetts; Rhode Island; Connecticut; Colorado; Kansas; Montana; Nebraska; New Mexico; North Dakota; Oklahoma; South Dakota; Texas; Wyoming; Illinois; Indiana; Iowa; Kansas; Michigan; Minnesota; Missouri; Nebraska; North Dakota; Ohio; South Dakota; Wisconsin; Alabama; Arkansas; Delaware; Florida; Georgia; Kentucky; Louisiana; Maryland; Mississippi; North Carolina; South Carolina; Tennessee; Virginia; West Virginia; New York; New Jersey; Pennsylvania provinces
 Near Waco (Texas)
 Colorado; Kansas; Montana; Nebraska; New Mexico; North Dakota; Oklahoma; South Dakota; Texas; Wyoming; Alabama; Arkansas; Delaware; Florida; Georgia; Kentucky; Louisiana; Maryland; Mississippi; North Carolina; South Carolina; Tennessee; Virginia; West Virginia provinces
 Colorado; Kansas; Montana; Nebraska; New Mexico; North Dakota; Oklahoma; South Dakota; Texas; Wyoming; Illinois; Indiana; Iowa; Kansas; Michigan; Minnesota; Missouri; Nebraska; North Dakota; Ohio; South Dakota; Wisconsin; Maine; New Hampshire; Vermont; Massachusetts; Rhode Island; Connecticut; New York; New Jersey; Pennsylvania provinces
 Los Angeles district (California province)
 Black Forest area (El Paso district; Colorado province)
 Illinois; Indiana; Iowa; Kansas; Michigan; Minnesota; Missouri; Nebraska; North Dakota; Ohio; South Dakota; Wisconsin; New York; New Jersey; Pennsylvania; Maine; New Hampshire; Vermont; Massachusetts; Rhode Island; Connecticut; Alabama; Arkansas; Delaware; Florida; Georgia; Kentucky; Louisiana; Maryland; Mississippi; North Carolina; South Carolina; Tennessee; Virginia; West Virginia provinces
 Yarnell area (Yavapai district; Arizona province)
 Cleveland; Lincoln; Catawba districts (North Carolina province); Pennsylvania province
 Missouri; Kansas; Tennessee; Arkansas; Oklahoma provinces
 San Antonio town (Bexar district; Texas province)
 Iowa; Michigan; Minnesota; Wisconsin provinces
 Yosemite valley (Mariposa district; California province)
 Colorado; Wyoming; Montana provinces
 Lafayette; Lyons; Longmont towns (Boulder district; Colorado province); Larimer; El Paso; Broomfield districts (Colorado province); New Mexico province
 Shasta district (California province)
 Illinois; Indiana; Kentucky; Ohio; Michigan; Wisconsin; Missouri provinces
 Oklahoma; Texas; California; New Mexico; Arizona provinces
 Austin district (Texas province)
 Michigan; Ohio; New York; Vermont; Maine; Kansas; Iowa; Texas; Wisconsin; Illinois; Minnesota; Arkansas; Louisiana; Mississippi; Kentucky provinces
 Louisiana; South Carolina; Mississippi provinces
 Alabama; Arkansas; Connecticut; Delaware; Florida; Georgia; Kentucky; Louisiana; Maine; Maryland; Massachusetts; Mississippi; New Hampshire; New Jersey; New York; North Carolina; Oklahoma; Pennsylvania; Rhode Island; South Carolina; Tennessee; Texas; Vermont; Virginia; West Virginia provinces
 Nelson; Carroll districts (Kentucky province)
 Texas; Oklahoma; Louisiana provinces
 San Francisco
 New York; Minnesota; Georgia; Maryland; Alaska; Alabama; Mississippi; Louisiana; North Carolina; South Carolina; Ohio; Indiana; Illinois; Pennsylvania; Michigan; New Jersey; Virginia; Kentucky; Missouri provinces
 Illinois; Indiana; Iowa; Kansas; Michigan; Minnesota; Missouri; Nebraska; North Dakota; Ohio; South Dakota; Wisconsin; Colorado; Kansas; Montana; Nebraska; New Mexico; North Dakota; Oklahoma; South Dakota; Texas; Wyoming; Maine; New Hampshire; Vermont; Massachusetts; Rhode Island; Connecticut; New York; New Jersey; Pennsylvania provinces
 Illinois; Indiana; Iowa; Kansas; Michigan; Minnesota; Missouri; Nebraska; North Dakota; Ohio; South Dakota; Wisconsin; Maine; Massachusetts; New Hampshire; Vermont; Rhode Island; Connecticut; New York; New Jersey; Pennsylvania; Maryland provinces
 Georgia; Alabama; Mississippi; Louisiana; North Carolina; South Carolina provinces
 District of Columbia; New York; Georgia; South Carolina; North Carolina; Pennsylvania provinces
 Oso village (Snohomish district; Washington province)
 California; Colorado; Kansas; Montana; Nebraska; New Mexico; North Dakota; Oklahoma; South Dakota; Texas; Wyoming; Illinois; Indiana; Iowa; Kansas; Michigan; Minnesota; Missouri; Nebraska; North Dakota; Ohio; South Dakota; Wisconsin; Tennessee; New York; New Jersey; Pennsylvania provinces
 Colorado; Kansas; Montana; Nebraska; New Mexico; North Dakota; Oklahoma; South Dakota; Texas; Wyoming; Mississippi; Alabama; Arkansas; Delaware; Florida; Georgia; Kentucky; Louisiana; Maryland; Mississippi; North Carolina; South Carolina; Tennessee; Virginia; West Virginia; Illinois; Indiana; Iowa; Kansas; Michigan; Minnesota; Missouri; Nebraska; North Dakota; Ohio; South Dakota; Wisconsin; Florida; Alabama; New York; New Jersey; Pennsylvania provinces
 Hutchinson district (Texas province); San Diego district (California province)
 Orland (California)
 Illinois; Indiana; Iowa; Kansas; Michigan; Minnesota; Missouri; North Dakota; Ohio; South Dakota; Wisconsin; Kansas; Nebraska; New Mexico; North Dakota; Oklahoma; South Dakota; Texas; Wyoming; Arizona; Idaho; Montana; Nevada; New Mexico; Utah; Wyoming; New York; New Jersey; Pennsylvania; Maine; New Hampshire; Vermont; Massachusetts; Rhode Island; Connecticut provinces
 Colorado; Kansas; Montana; Nebraska; New Mexico; North Dakota; Oklahoma; Texas; Wyoming; Illinois; Indiana; Iowa; Michigan; Minnesota; Missouri; Ohio; South Dakota; Wisconsin; New York; New Jersey; Pennsylvania; Maine; New Hampshire; Vermont; Massachusetts; Rhode Island; Connecticut; Tennessee provinces
 Hawaii province
 Illinois; Indiana; Iowa; Kansas; Michigan; Minnesota; Missouri; Nebraska; North Dakota; Ohio; South Dakota; Wisconsin; Maine; New Hampshire; Vermont; Massachusetts; Rhode Island; Connecticut; New York; New Jersey; Pennsylvanie; Maryland provinces
 San Francisco Bay (San Francisco district) ; Napa Valley (Napa district) ; Sonoma; Solano district (California province) ; Vallejo; Mare Island cities (Solano district; California province)
 Arkansas; Louisiana; Alabama; Mississippi; Kentucky; Illinois; Texas provinces
 New York; New Hampshire; Michigan provinces
 Los Angeles; San Diego districts (California province); Oregon province
 Orange; Mariposa; Tuolumne; Los Angeles; San Francisco; Sacaramento districts (California province)
 Blair area (Washington district; Nebraska province); Iowa; Kansas; Arkansas; Wyoming provinces
 Pensacola (Florida)
 Charleston (West Virginia)
 San Joaquin district (California province)
 Illinois; Wisconsin; Pennsylvania provinces
 Connecticut; Maine; Massachusetts; New Hampshire; New Jersey; New York; Rhode Island
 Tennessee; Kansas; District of Columbia; Boston; Ohio; Virginia; Georgia; North Carolina; South Carolina provinces
 Illinois; Michigan; Massachusetts; New York; Connecticut; Indiana provinces
 Massachusetts; New York; Tennessee; Maryland; Virginia; Pennsylvania; Kentucky; North Carolina; Michigan; Rhode Island; New Hampshire; Ohio; South Carolina; Illinois; District of Columbia; Maine; Vermont provinces
 Eglin (Florida)
 New York; Pennsylvania; Kentucky; West Virginia; Arkansas provinces
 Moore area (Cleveland district; Oklahoma province); Osage; Tulsa districts (Oklahoma province); Kansas; Missouri; Arkansas provinces
 Fairdale area (DeKalb district; Illinois province); Rochelle town (Ogle district; Illinois province); Missouri; North Carolina; Indiana; Ohio; Kentucky; Texas; Iowa; Arkansas; Michigan; West Virginia; Wisconsin; Pennsylvania; Oklahoma; Kansas; Tennessee provinces
 Texas; Louisiana; Alabama; Mississippi; Kentucky; Georgia; Florida provinces
 Philadelphia
 Nashville town (Howard district; Arkansas province); Van town (Van Zandt district; Texas province); Delmond town (Douglas district; South Dakota province); Colorado; Oklahoma; Kansas; Iowa provinces
 Kansas; Nebraska; Texas; Oklahoma; Minnesota; Iowa; Wisconsin provinces
 San Marcos area (Hays district; Texas province); Claremore area (Hays district; Oklahoma province)
 Texas; Oklahoma; Kansas; Nebraska; Missouri; Colorado; Minnesota; South Dakota provinces
 Texas; Oklahoma; Colorado; Arkansas; Kansas; Louisiana; Georgia; Ohio; South Carolina
 Santa Barbara (California)
 Colorado; Illinois provinces
 Lake; Napa; Solano; Yolo; Modoc; Colusa districts (California province)
 Illinois; Indiana; Wisconsin; Minnesota; Ohio; Iowa; Kentucky; Tennessee; Missouri; South Carolina; North Carolina
 Hillsborough; Pasco; Pinellas; Dixie; Taylor districts (Florida province)
 Chicago; Lincolnwood towns (Cook district; Illinois province); Wood Dale town (DuPage district; Illinois province); Lancaster town (Coos district; New Hampshire province); Indiana; Ohio; Connecticut; Michigan; Massachusetts; Wisconsin; Rhode Island; Maine; New York provinces
 California; Idaho; Montana; Oregon; Washington provinces
 Lake; Napa; Sonoma; Butte districts (California province)
 Hildale town (Washington district; Utah province); Las Vegas town (Clark district; Nevada province)
 South Carolina; North Carolina
 Austin; Houston districts (Texas province); Lousiana province
 Texas; Kansas; Oklahoma provinces
 Dallas; Ellis; Collin districts (Texas province); Mississippi; Tennessee; Arkansas; Alabama; Georgia; New Mexico; Missouri; Kentucky; Indiana; Oklahoma; Illinois provinces
 Mississippi; Missouri; Kentucky; Tennessee; Arkansas; Alabama; Illinois; Indiana; Louisiana provinces
 Aliso Canyon
 Amador; Calaveras (California)
 California; Nevada; Oregon; Washington; Idaho; Montana; Utah; Arizona provinces
 Washington D.C. (District of Columbia district; District of Columbia province); New York; New Jersey; Pennsylvania; Maryland; Virginia; Tennessee; Kentucky; Delaware; West Virginia; Georgia; North Carolina provinces 
 Ventura; Orange; San Diego; Los Angles districts (California province)
 Los Angeles (California)
 Near Oahu coast (Hawai)
 Alabama; Mississippi; Virginia; Connecticut; Florida; Georgia; Louisiana; Massachusetts; Maryland; North Carolina; New Jersey; New York; Pennsylvania; South Carolina; Texas 
 California; Lousiana; Texas; Arkansas; Tennessee; Mississippi; Alabama; Oklahoma; Kentucky; Ohio provinces
 Texas; Mississippi; Louisiana; Florida provinces
 Texas; Oklahoma; Louisiana; Arkansas; Mississippi; Alabama; Florida provinces
 Dallas-Fort Worth (Dallas; Wise; Tarrant; Denton; Parker); Wylie; Plano; Little Elm; Rockwall; Bettie; Emory in Collin; Denton; Upshur; Rockwall; Rains; San Antonio metro regions; Helotes; Alamo Heights; Kirby; Hollywood Park; Carrizo Springs; Terrel Hills (Bexar; Dimmit) (Texas); Oklahoma; Kansas; Missouri; Arkansas; Mississippi; Louisiana
 Fayette; Grimes; Harris; Parker counties; Houston districts (Texas province)
 Texas; Oklahoma; Arkansas; Louisiana; Mississippi; Kansas; Virginia; North Carolina; Georgia; Missouri; Illinois; West Virginia provinces
 Oklahoma; Colorado; Nebraska; Kansas; Iowa; Missouri; Arkansas; Illinois; Kentucky; Texas;Tennessee states
 Palestine city (Anderson district; Texas province); Houston district (Texas province)
 Houston district (Texas province); Brenham city (Washington district; Texas province); Montana; Kansas; Missouri; Colorado
 Texas; Oklahoma; Arkansas; Kansas; Nebraska provinces
 Greenbier district (West Virginia province); Ohio; Indiana; Illinois; Wisconsin; Virginia
 California province
 Los Angeles; San Francisco districts (California province)
 Near Lockhart (Texas)
 Louisiana; Mississippi; Missouri; Illinois; Indiana; Allamakee; Clayton; Fayette; Howard; Winneshiek counties (Iowa)
 Lower Lake; Clearlake (Lake district; California province)
 Georgia; Florida; South Carolina; New York; New Jersey; Cedar Key; Florida; Aurora (North Carolina); Virginia Tidewater region
 Minnesota; Buffalo; Chippewa; Clark; Columbia; Crawford; Eau Claire; Jackson; La Crosse; Monroe; Richland; Sauk; Trempealeau; and Vernon (Wisconsin); Allamakee; Benton; Black Hawk; Bremer; Buchanan; Butler; Cedar; Chickasaw; Delaware; Floyd; Franklin; Linn; Wright (Iowa)
 Hoboken (New Jersey)
 Florida; Georgia; South Carolina; North Carolina; Virginia provinces
 Near Plam Springs (California)
 Gatlinburg city (Sevier district; Tennessee province)
 Oakland
 Alabama; Mississippi; Tennessee; Georgia; South Carolina; Louisiana; North Carolina provinces
 Cushing (Oklahoma)
 Northern (Missouri; Maryland; Oklahoma; Indiana; Michigan; New Mexico; Ohio; Virginia)
 Texas; Oklahoma; Kansas; Missouri; Nebraska; Illinois; Indiana; Kentucky; Ohio
 Texas; Louisiana (Shreveport; Haugton); Arkansas; Mississipi
 New York (Brooklyn; Atlantic Terminal station)
 Georgia (cook); Mississippi; Alabama; Louisiana; Florida states
 California; Nevada; Idaho; Colorado; Utah; Oregon states
 San Jose (North California)
 Center and south of California (San Diego; Los Angeles; San Francisco; Sacramento)
 Illinois; Missouri; Indiana; Arkansas; Kentucky; Tennessee; Ohio ; Georgia; Iowa; North Carolina; Virginia; Alabama; South Carolina; West Virginia; Michigan states
 South Carolina; Georgia; North Carolina; Tennessee; Alabama; Mssissippi; Florida; Kentucky ; Virginia 
 East and West Canton (Van Zandt county) (Texas); Kampville (St Charles) (Missouri); Logan; Marion; Miles Station (Macoupin); Sumner (Lawrence); Pawnee (Sangamon) (Illinois); Natural Dam (Crawford); Mississipi; Clay (Arkansas); Oak ridge (Morehouse) (Louisiana) ; Labette (Kansas); Cameron (Le Flore) (Oklahoma); Goshen (Oldham) (Kentucky) ; Ohio; Pennsylvania; West Virginia ; Mississipi ; Alabama ; Tennesse ; Indiana
 Colorado; New Mexico; Texas; Oklahoma; Missouri
