Crittenden; Daviess; Webster districts (Kentucky province)
 Pacifique (au large de la Californie)
 Bullock; Montgomery districts (Alabama province); Colquitt; Grady; Mitchell; Thomas; Tift districts (Georgia province); Washington district (Floride province); Lonoke; Prairie; Saline districts (Arkansas province)
 Kentucky; Ohio provinces
 Gainesville; Alachua areas (Alachua district; Florida province); Lafayette; Gulf districts (Florida province)
 Fort Worth Texas city (Tarrant district; Texas province); Reagan; Burleson districts (Texas province)
 Franklin; Jefferson districts (Missouri province)
 Los Alamos; Rio Arriba; Sandoval; Santa Fe districts (New Mexico province)
 Near Wilkes-Barre (Pennsylvania)
 Concord (North Carolina)
 Oklahoma province
 Sarasota district (Florida province)
 Liberty district (Texas province)
 Franklin; Jefferson; Gasconade districts (Missouri province)
 South-West Louisiana
 Adams; Columbia; Crawford; Dane; Dodge; Grant; Green; Iowa; Juneau; La crosse; Lafayette; Monroe; Richland; Rock; Sauk; Vernon districts (Wisconsin province)
 Anderson; Benton; Cheatham; Davidson; Henry; Hickman; Houston; Jackson; Knox; Lake; Obion; Perry; Pickett; Stewart districts (Tennessee province)
 Park; Jefferson; Larimer districts (Colorado province)
 Near Cleveland
 Hanford area (Benton district; Washington province)
 Texas; Louisiana; Alabama provinces
 Alaska province
 Granite Falls city (Yellow Medicine; Minnesota province)
 Arizona; California; Colorado; Idaho; Montana; Nevada; New Mexico; Oregon; South Dakota; Texas; Utah; Washington; Wyoming; Florida; North Dakota provinces
 Morris; Sussex districts (New Jersey province)
 Pennsylvania province
 Near Carlsbad (Nouveau Mexique)
 Near Yountville city (Napa district; California province)
 Xenia city (Greene district; Ohio province)
 Miami-Dade; Monroe; Broward; Collier districts (Florida province)
 Boston
 Buffalo city (Erie district; New York province)
 Texas; Oklahoma; New Mexico; Arkansas; Missouri; Minnesota provinces
 Maui district (Hawaii province)
 Alabama; Georgia; Louisiana; North Carolina; South Carolina; Tennessee; Virginia; New York; Pennsylvania; Massachussetts provinces
 Tuscaloosa district (Alabama province); Connecticut; Florida; Georgia; Massachusetts; Mississippi; Norh Carolina; New Jersey; New York; Pennsylvania; Rhode Island provinces
 Marana Northwest Regional Airport; Tucson (Arizona)
 South Carolina; Georgia; Alabama; Florida; Louisiana; Texas provinces
 Wyoming province
 Oak Orchard (Delaware State)
 Beyers (Denver; Colorado)
 Seattle city (King district); Tacoma city (Pierce district); Olympia city (Thurston district) (Washington province)
 Georgia
 Calhoun; Lee; Pontotoc; Prentiss; Union districts (Mississippi province)
 Virginia; New Jersey; Pennsylvania; North Carolina; West Virginia; Maryland provinces
 Kearny; Trego; Ellis; Rooks; Ford; Osborne; Smith; Jewell; Edwards; Republic; Washington districts (Kansas province); Union city (Franklin district; Missouri province); Johnson; Pettis; Cooper; Callaway; St Charles; Gentry; Worth; Clark; Madison districts (Missouri); Beaver; Pontotoc; Coal; Johnston; Atoka; Haskell; Pottawatomie districts (Oklahoma province); Wichita; Cooke; Carson; Hutchinson; Hansford; Wheeler districts (Texas province); Thayer; Gage; Sarpy; Webster; Nuckolls districts (Nebraska province); Mills; Pottawattamie; Guthrie; Boone; Hamilton; Wapello; Johnson; Black Hawk; Benton; Fayette; Webster; Ringgold districts (Iowa province); Madison district (Illinois province)
 Marion; Clay districts (Florida province)
 Aspen
 Texas; Mississippi; Louisiana; Florida; Pennsylvania; South Carolina; North Carolina; Georgia; Pensylvania; New Jersey; Virginia; Iowa provinces
 Cleveland area (Henry district; Illinois province); Barstow; Osborn areas (Rock Island district; Illinois province)
 New Hampshire; Vermont; Maine; Massachusetts; Rhode Island provinces
 Minnesota; Iowa; Wisconsin; Illinois provinces
 Hoisington city (Barton district; Kansas province)
 Bering sea
 Florida province
 Blue Grass; Bettendorf cities (Scott district; Iowa province); Leon city (Decatur district; Iowa province)
 Oregon; Washington; Idaho; California; Nevada; Colorado; Arizona; Wyoming; Texas; Oklahoma provinces
 Virginia province
 Loop (Chicago)
 Siren city (Burnett district; Wisconsin province)
 Brainerd city (Crow King district; Minnesota province)
 Watkins area (Adams district; Colorado province)
 Cordell city (Washita district; Oklahoma province); Polk; Merrick; Hamilton districts (Nebraska province)
 "Howard; Prince Georges districts (Maryland province)";
 Alabama
 Pasadena city (Harris district; Texas province)
 Hondo city (Medina district; Texas province)
 Queens area (New York)
 New York
 Tennessee; Kentucky; West Virginia; Virginia; Georgia provinces
 Texas province
 Illinois; Indiana; Iowa; Kansas; Michigan; Minnesota; Missouri; Nebraska; North Dakota; Ohio; South Dakota; Wisconsin provinces
 Tennesse; Kentucky provinces
 District of Columbia province
 Jakson town (Dakota district; Nebraska province)
 Alabama; Louisiana; Virginia; North Carolina; South Carolina; Mississipi; Georgia; Pensylvania;
 Fallbrok area (San Diego district; Californie province)
 Cleveland; Comanche; Creek; Garvin; Grady; Greer; Harmon; Jackson; Kiowa; Lincoln; McClain; Nowata; Pottawatomie; Rogers; Stephens; Tillman; Tulsa; Alfalfa; Beaver; Beckham; Blaine; Caddo; Canadian; Cimarron; Custer; Dewey; Ellis; Garfield; Grant; Harper; Kay; Kingfisher; Logan; Major; Noble; Oklahoma; Osage; Pawnee; Payne; Roger Mills; Texas; Washington; Washita; Woods; Woodward districts (Oklahoma province); Missouri; Kansas; New York; Indiana; Ohio provinces
 Oklahoma; Missouri; Wisconsin; Michigan; Arkansas provinces
 Sevier; Blount; Knox; Hawkins districts (Tennessee province); Cumberland; Bell districts (Kentucky province); Wise; Smyth; Washington districts (Virginia province); Cabell district (West Virginia province); North Carolina; Mississippi; Arkansas; Texas provinces
 Tennessee; Virginia; Kentucky; Ohio; Arkansas; Oklahoma; Texas provinces
 Lincoln district (New Mexico province)
 Placentia (Orange county; Los Angeles; California)
 Pike district (Kentucky province); Virginia province
 Near Inagua Isl. (Florida)
 Happy town (Randall; Swisher districts; Texas province)
 Wayne; Jefferson districts (Illinois province)
 Near Crescent city (Florida)
 Breckinridge; Meade; Crittenden; Webster; Hopkins; Ohio; Hardin; Edmonson districts (Kentucky province); Bollinger; Howell districts (Missouri province); Charles; Calvert; Dorchester; Wicomico; Cecil districts (Maryland province); Illinois (Clay;Union; Johnson;Pope; Moultrie; Saline; Bond); Gordon district (Georgia province); Atchison district (Kansas province); Erie; Allegany districts (New York province); Stark district (Ohio province); Indiana; Mercer; Venango; Butler; Armstrong; Columbia; Lebanon; Allegheny districts (Pennsylvania province); Rutherford; Lake; Henry; Carter districts (Tennessee province); Virginia (Shenandoah; Greensville; Bedford; (Campbell; Nottoway; Prince George); Marshall district (West Virginia province); Pontotoc; Chickasaw districts (Mississippi province); Perry district (Indiana province)
 Arizona province
 Sallisaw (Oklahoma)
 Georgia; Alaska provinces
 Colorado province
 Arizona province
 Arizona province
 Comal; Guadalupe; Bandera; Uvalde; McMullen; Taylor districts (Texas province)
 Near Kensington (Maryland)
 Alabama; district of Columbia; Illinois; Indiana; Louisiana; Mississippi; Texas; Florida; Massachusetts; Missouri; New York City; Ohio; Georgia; Kentucky; Maryland; Michigan; Nebraska; South Dacota; Tennessee; Texas; Virginia; Wisconsin
 Ladysmith city (Rusk district; Wisconsin province)
 Maine State
 Georgia province
 Claremont; Glendora; La Verne areas (Los Angeles district; California province))
 Oregon province
 Louisiane; Mississippi; Alabama; Tennessee provinces
 nan;
 Tipton; Carroll; Montgomery; Sumner; Bedford; Coffee; Morgan; Cumberland; Anderson districts (Tennessee province); Henry; Dale; Fayette; Walker; Winston; Lamar; Cullman; Tuscaloosa; Jefferson; Cherokee districts (Alabama province); Van Wert; Paulding; Putnam; Defiance; Athens; Logan; Union; Seneca; Ottawa districts (Ohio province); Allen district (Kentucky province); Cross; Crittenden; Mississippi districts (Arkansas province); Appling; Cherokee; Pickens; Dawson; Atkinson; Coffee districts (Georgia province); Blackford district (Indiana province); Lowndes; Winston; Noxubee; Oktibbeha districts (Mississippi province); Mercer district (Pennsylvania province); McCormick district (South Carolina province)
 St. Tammany; Terrebonne; Lafayette; Acadia; Evangeline; Rapides districts (Louisiana province)
 Washington DC (District of Columbia district; District of Columbia province); North Carolina; South Carolina; Virginia; New York; Pennsylvania; Kentucky; New Jersey; Maryland; Missouri; Tennesse provinces
 Harlem (New York)
 Marin; Los Angeles; Santa Cruz districts (California province); Oregon; Nevada provinces
 Oklahoma; Massachusetts; New York; Arkansas; Missouri; New Mexico; Louisiana; Texas provinces
 Fulton; Tioga; Broome; Oswego; Delaware; Dutchess districts (New York province); Wayne district (Pennsylvania province); Connecticut; Massachusetts; Michigan; New Hampshire; New Jersey; Ohio; Wisconsin provinces
 Illinois; Indiana; Iowa; Kansas; Michigan; Minnesota; Missouri; Nebraska; North Dakota; Ohio; South Dakota; Wisconsin provinces
 Charlotte airport (North Carolina)
 Kinston; near Chapel Hill (North Carolina)
 Delaware; Kentucky; Massachusetts; Maryland; North Carolina; New Hampshire; New Jersey; New York; District of Columbia; Ohio; Pennsylvania; Rhode Island; Tennessee; Virginia; Vermont; West Virginia; Illinois; Missouri; Iowa; Nebraska; Connecticut provinces
 Chicago
 West Warwick (Rhode Isl. State)
 Hartford (Connecticut)
 Near Fort Drum (New York state)
 Mitchell; Worth districts (Georgia province); Jackson district (Alabama province) North Carolina; South Carolina; Tennessee provinces
 Denver; Boulder districts (Colorado province); Wyoming province
 Yonkers (New York)
 Colbert; Lauderdale; Limestone; Madison; Jackson; Dekalb; Lamar; Walker;St Clair; Talladega; Shelby; Clay districts (Alabama province); Mississippi; Craighead; White; Woodruff; Cross districts (Arkansas province); Adams; Weld; Morgan districts (Colorado province); Cherokee; Franklin; Madison; Elbert; Hart; Heard; Coweta districts (Georgia province); Marion; Mahaska; Lee; Van Buren; Jefferson; Henry; Louisa districts (Iowa province); Adams; Hancock; Mc Donough; Bureau; Henry; Brown; Mason; Fulton; Pope; Schuyler; Sangamon; Pulaski; Massac; Alexander; Jasper; Mercer; Warren; Tazewell districts (Illinois province); Perry; Kosciuscko; Putnam districts (Indiana province); Crawford; Wyandotte; Leavenworth; Neosho; Labette; Cherokee; Butler; Greenwood; Osage; Woodson; Allen; Douglas; Anderson; Linn; Marion districts (Kansas province); Calloway; Webster;Daviess; Mason; Lewis; Union; Henderson; Pulaski districts (Kentucky province); Lawrence; Cass; Platte; Clay; Jackson- Kansas city; Greene; Christian; Camden; Lewis; Barton; Cedar; Polk; Hickory; Dallas; Jasper; Johnson; Newton; Dade; Pettis; Dunklin; Pemiscot; Putnam; Scott; Knox; Scotland; Clark; Macon; Shelby; Mercer; Lafayette; Saline; Cape Girardeau; Bollinger; Pulaski districts (Missouri province); Marshall; Benton; Tippah; Alcorn; Newton; Scott; Chickasaw; Monroe; Lee; Itawamba; Madison; Sunflower districts (Mississippi province); Washington; Vance; Chowan; Bertie; Hertford; Northamton districts (North Carolina province); Saunders district (Nebraska province); Okhlaoma; Moore-Cleveland; Ottawa; Stephens; Creek; Lincoln; Canadian; Caddo; Osage; Noble; Le Flore; Marshall; Love; Jefferson districts (Okhahoma province); Aiken; Abbeville; Williamsburg districts (South Carolina province); Perkins; Todd didstricts (South Dakota province); Dyer; Madison; Hamilton-Chattanooga; Gibson; Weakley; Henry; Stewart; Henderson; Carroll; Montgomery; Robertson; Williamson; Davidson; Cannon; Lincoln; Lawrence; Hardin; McNairy districts (Tennessee province); ood; Upshur; Harrison; Marion districts (Texas province)
 Summerhaven area (Pima district; Arizona province); Lemmon mount (Pima district; Arizona province)
 Chicago
 Allen; Carroll; Adams; Cass; Howard; Tipton; Wells; Miami; Boone; Jennings; Clay; Tippecanoe; Huntington; Decatur districts (Indiana province); Allen; Auglaize; Van Wert; Darke; Mercer; Miami districts (Ohio province); Mercer; Shelby; Logan; Hamilton; Winnebago districts (Illinois province)
 Santa Monica (California)
 Palm Beach district (Florida province)
 North Carolina; Maryland; Virginia; West Virginia; Delaware; Pennsylvania; New Jersey; District of Columbia provinces
 Staten Island (New York)
 Snohomish; Mason; Grays Harbor; Jefferson; Clallam; Skagit; Whatcom districts (Washington province)
 Fontana; Rancho Cucamonga areas (San Bernardino district; California province)
 West Virginia; Tennessee; Kentucky; Pennsylvania; North Carolina; Virginia provinces
 Pennsylvania; Connecticut; New York; New Jersey; Vermont; Virginia; Massachusetts; Rhode Island provinces
 Paso Robles; Templeton; Atascadero; Cambria; Morro Bay; Oceano villages (San Luis Obispo district; California province)
 San Bernardino district (California province)
 Los Angeles district (California province)
 Morgan; Leslie; Breathitt; Menifee districts (Kentucky province); Wayne; Cabell; Kanawha; Lincoln; Mingo districts (West Virginia province); Dickenson; Tazewell; Wise; Buchanan districts (Virginia province); Alabama; Connecticut; Delaware; Florida; Georgia; Massachusetts; Maryland; North Carolina; New Hampshire; New Jersey; New York; Pennsylvania; Rhode Island; South Carolina; Tennessee; Vermont provinces
 Tennessee; Alabama; Georgia provinces
 Mason; Tazewell; Logan; Will; De Witt districts (Illinois province)
 Orleans; St. John the Baptist; Terrebonne; St. Tammany; Tangipahoa districts (Louisiana province); Hancock; Harrison; Jackson; Pike; Walthall districts (Mississippi province); Bay district (Florida province); Mobile; Baldwin; Lee districts (Alabama province); Sumter; Bulloch; Fulton; DeKalb; Cobb; Clayton; Gwinnett districts (Georgia province); Wake district (North Carolina province)
 San Bernardino district (California province)
 Baker (California)
 Beaumont; Port Arthur areas (Jefferson district; Texas province); Sugar Land area (Fort Bend district; Texas province); Smith district (Mississipi province); Dallas; Harris districts (Texas province); Los Angeles district (California province); Alabama; Arkansas; Florida; Georgia; Louisiana; Maryland; Missouri; North Carolina; Oklahoma; South Carolina; Tennesse; Virginia; West Virginia provinces
 Alabama; Illinois; Indiana; Louisiana; Michigan; Missouri; Mississippi; New York; Tennessee;Texas; Pennsylvania; Nebraska; Wisconsin provinces
 Arkansas; Texas provinces
 North Carolina; South Carolina; Iowa; Missouri; Ohio; Maryland; Nebraska; New York; Virginia; Minnesota; Indiana; Illinois; Pennsylvania; Oklahoma; Georgia; Kansas; New Jersey; West Virginia; Maine provinces
 Near Virginia coast
 Arkansas; Louisiana; North Carolina; Oklahoma; South Carolina; Texas; Virginia; Kansas; Missouri; Mississippi provinces
 Antigo area (Langlade district; Wisconsin province); Pembina; Walsh districts (North Dakota province)
 Los Angeles; Riverside; San Diego; Santa Barbara districts (California province)
 Morgan; Sangamon; Scott districts (Illinois province); Clark; Floyd; Washington districts (Indiana province); Adair; Appanoose; Benton; Clay; Dallas; Grundy; Humboldt; Jones; Linn; Marshall; Pocahontas; Story; Warren districts (Iowa province); Jackson; Linn; Shawnee; Republic districts (Kansas province); Estill; Fayette; Henderson; Henry; Magoffin; Martin; Powell; Pulaski districts (Kentucky province); Washington district (Maryland province); Sanilac; St. Clair; Tuscola districts (Michigan province); Gentry; Holt; Linn; Livingston; Macon; St. Clair districts (Missouri province); Adams; Cass; Clay; Custer; Franklin; Fillmore; Furnas; Gage; Harlan; Jefferson; Lancaster; Nuckolls; Otoe; Saline; Thayer; Webster; York districts (Nebraska province); Broome; Delaware districts (New York province); Athens; Brown; Fayette; Perry; Ross districts (Ohio province); Caddo; Noble; Osage; Pawnee; Tillman districts (Oklahoma province); Crawford district (Pennsylvania province); Hawkins district (Tennessee province); Nolan; Taylor; Val Verde districts (Texas province); Lancaster; Lee; Loudoun; Scott districts (Virginia province); Berkeley district (West Virginia province); Manitowoc; Dane; Columbia districts (Wisconsin province); North Carolina; South Carolina provinces
 Wayne; Oakland; Macomb; Livingston districts (Michigan province)
 Geneva; Jefferson; Lauderdale; Limestone; Madison districts (Alabama province); Cross; Mississippi; Nevada districts (Arkansas province); Crawford; Jefferson; Logan; Perry; Washington districts (Illinois province); Clark; Crawford; Hamilton; Hancock; Hendricks; Jackson; Madison; Marion; Monroe; Morgan; Miami; Owen; Tippecanoe; Vanderburgh; Warrick; Washington districts (Indiana province); Buchanan; Lee; Iowa districts (Iowa province); Cloud; Harper; Marshall; Republic; Sumner districts (Kansas province); Henry; Hopkins; Jefferson; Knox; Muhlenberg; McCracken; Webster districts (Kentucky province); St. Clair district (Michigan province); Tippah district (Mississippi province); Buchanan; Clinton; DeKalb; Daviess; Harrison; Laclede; Platte; St. Louis districts (Missouri province); Holt; Lincoln districts (Nebraska province); Adams district (Ohio province); Blaine; Canadian; Creek; Custer; Kingfisher; Mayes; Oklahoma; Tulsa; Wagoner districts (Oklahoma province); Brown; Edmunds; Clay districts (South Dakota province); Bedford; Bradley; Lincoln; Franklin; Giles; Grundy; Hardin; Moore districts (Tennessee province); Cottle; Houston; Tarrant districts (Texas province); Boone; Braxton; Cabell; Jackson; Kanawha; Lewis; Logan; Mason; Morgan; Mingo; Putnam; Upshur; Wayne; Wood; Wyoming districts (West Virginia province); Louisiana province
 Milam; Guadalupe; Bexar districts (Texas province); Eagle district (Colorado province); Mississippi province; Richland district (South Carolina province); Franklinton city (Washington district; Louisiana province); Bufford city (Gwinnett district; Georgia province)
 Carson City district (Nevada province); Los Angeles district (California province)
 Covina (California)
 Bay; Calhoun; Escambia; Franklin; Gadsden; Gulf; Holmes; Jackson; Jefferson; Leon; Liberty; Madison; Okaloosa; Santa Rosa; Taylor; Wakulla; Walton; Washington districts (Florida province); South Carolina; North Carolina provinces
 Shasta Lake area (Shasta districts; California province)
 Richmond; Lynchburg; Chesterfield districts (Virginia province); South Carolina; North Carolina provinces
 Martin; Palm Beach districts (Florida province); North Carolina; South Carolina; Ohio provinces
 Alabama; Louisiana; Mississippi; Florida; Pennsylvania; Maryland; New Jersey; Ohio; North Carolina; West Virginia; Georgia; Tennessee provinces
 Florida province
 Caroline district (Virginia province)
 Manoa Valley area (Honolulu district; Hawaii province)
 Pennsylvania; New Jersey provinces
 New York
 Pennsylvania; Ohio; Maryland; Virginia; West Virginia
 Arkansas; Illinois; Iowa; Indiana; Missouri; Oklahoma provinces
 Connecticut; Delaware; Maryland; Maine; New Hampshire; New Jersey; New York; Pennsylvania; Rhode Island; Vermont provinces
 Aiken county (South Carolina)
 La Conchita area (Ventura district; California province); Malibu area (Los Angeles district; California province); Sacramento district (California province); Arizona; Ohio provinces
 New York; Connecticut; Wisconsin; Ohio; Maryland; Massachusetts; Iowa provinces
 Los Angeles
 Los Angeles district (California province)
 Houston (Texas)
 New Jersey; Pennsylvania; New York; Maine provinces
 Rankin district (Mississippi province)
 Idaho province
 Florida; Georgia provinces
 Mobile; Bayou La Batre; Dauphin Island; Coden areas (Mobile district; Alabama province); New Orleans city (Orleans district; Louisiana province); Slidell area (St. Tammany district; Louisiana province); St. Bernard district (Louisiana province); Biloxi; Gulfport cities (Harrison district; Mississippi province); Pascagoula city (Jackson district; Mississippi province); Waveland; Bay St. Louis cities (Hancock district; Mississippi province); Georgia; Florida provinces
 Wisconsin province
 Near Dallas (Texas)
 Louisiana; Texas; Mississippi provinces
 New York state
 Keene; Alstead; Stoddard; Unity; Hinsdale; Walpole areas (Cheshire district; New Hampshire); Brattleboro; Guilford areas (Windham district; Vermont province); Pittsfield area (Berkshire district; Massachusetts province); Greenfield area (Franklin district; Massachusetts province); Northbridge; Worcester; Southbridge areas (Worcester district; Massachusetts); Spring Lake area (Monmouth district; New Jersey province); Wayne; Little Falls; Pompton Lakes areas (Passaic district; New Jersey province); Oakland; Lodi; Westwood areas (Bergen district; New Jersey province); Bound Brook area (Somerset district; New Jersey province); Tolland; Windham; Hartford districts (Connecticut province)
 Florida Keys; Naples areas (Collier district; Florida province)
 Maine; New Hampshire; Vermont; Massachusetts; Rhode Island; Connecticut; New York; New Jersey; Pennsylvania; Idaho; Michigan; Minnesota; Montana; North Dakota; Oregon; South Dakota; Washington; Wisconsin; Wyoming provinces
 Arizona; Nevada; Oklahoma; Utah; Missouri; Kentucky; Ohio; Mississippi provinces
 Near Miami Beach (Florida)
 Reno area (Washoe district; Nevada province); Truckee area (Nevada district; California province); Napa; Sonoma; Mendocino; Marin; Solano; Los Angeles districts (California); Carson City district (Nevada province)
 Texas; Oklahoma provinces
 Tallmansville (Virginia)
 Missouri; Arkansas; Illinois; Indiana; Kansas; Oklahoma provinces
 Tennessee; Illinois; Arkansas; Indiana; Oklahoma; Missouri; Kentucky; Iowa provinces
 Sumner; Warren districts (Tennessee province); Alabama; Georgia; Indiana; Kansas; Kentucky; Ohio provinces
 Amador; Calaveras; Fresno; Merced; San Joaquin; San Mateo; Stanislau districts (California province)
 Kauai district (Hawaii province)
 Tarrant; Bexar districts (Texas province)
 New Hampshire; Maine; Massachusetts provinces
 Maryland; Pennsylvania; New York; Delaware; Virginia; New Jersey provinces
 Huron; Erie; Crawford; Lucas; Sandusky districts (Ohio province)
 California province
 Modesto city (Stanislaus district; California province)
 Florida
 El Paso district (Texas province)
 Lake district (Ohio province)
 New York province
 Alaska province
 South Carolina; North Carolina; Virginia provinces
 Near Lexington airport (Kentucky)
 Mercer; Jessamine; Franklin; Calloway; Montgomery districts (Kentucky province); Sharp; Clay; Fulton; Randolph; Lawrence districts (Arkansas province); Obion district (Tennessee province); Missouri; Indiana; Illinois provinces
 Prince William Sound area (Valdez-Cordova district; Alaska province)
 Riverside; Palm Springs cities (Riverside district; California province); San Diego district (California province)
 North Carolina; Alabama; Arizona; Arkansas; Louisiana; Maryland; Mississippi; Pennsylvania; South Dakota; Texas provinces
 Washington; Oregon provinces
 Anderson (Missouri)
 Erie; Niagara; Genesee; Orleans districts (New York province)
 Ventura district (California province)
 Hawai province
 Daytona beach (Volusia district; Florida province)
 Colorado provinces
 Kansas province
 Illinois; Indiana; Kentucky; Missouri; New York; Ohio; Pennsylvania; Tennessee provinces
 Oregon; Washington provinces
 Texas
 California; Texas; Georgia; South Carolina; Oklahoma; Missouri; Iowa; Michigan; New York; Maine; Kansas; Illinois provinces
 Indiana; Arkansas; Texas; Ohio; Missouri provinces
 Volusia; Lake; Sumter; Seminole districts (Florida province)
 New York; Vermont; New Jersey; Ohio; Pennsylvania provinces
 Alabama; Missouri; Georgia; Minnesota provinces
 Bronx (New York)
 Texas province
 Texas; Kansas; Oklahoma provinces
 Wichita Falls area (Wichita district; Texas province); Georgetown areas (Williamson district; Texas province); Burnet; Marble Falls; Granite Shoals areas (Burnet district; Texas province); Granbury area (Hood district; Texas province); Lampasas; Parker; Eastland districts (Texas province); Miami; Commerce areas (Ottawa district; Oklahoma province); Shawnee; Tecumseh; Maud areas (Pottawatomie district; Oklahoma province); Oklahoma city (Oklahoma district; Oklahoma province); Waurika area (Jefferson district; Oklahoma province); Bartlesville; Dewey areas (Washington district; Oklahoma province); Love; Lincoln districts (Oklahoma province); Coffeyville area (Montgomery district; Kansas province); Osawatomie area (Miami district; Kansas province); Allen; Labette; Neosho; Wilson; Woodson districts (Kansas province); Rockville; Papinville areas (Bates district; Missouri province); Vernon district (Missouri province)
 New York province
 North Texas; Oklahoma provinces
 Minneapolis (Minnesota)
 Alpine; Amador; Calaveras; El Dorado; Mono; Placer; Tuolumne districts (California province)
 Texas; Oklahoma; Missouri provinces
 Illinois; Colorado; Michigan; Minnesota; Wisconsin; Ohio; Oklahoma; North Dakota provinces
 Washington state
 Los Angeles; Orange; Riverside; San Bernardino; San Diego; Santa Barbara; Ventura districts (California province)
 Malibu area (Los Angeles district; California province)
 Washington; Oregon provinces
 Illinois; Iowa; Missouri; Minnesota; Kansas; Nebraska; Colorado; Michigan; Wisconsin; Wyoming provinces
 Oklahoma; Missouri; Iowa; Illinois; Kansas; Nebraska; Connecticut; Michigan; New York; New Jersey; Pennsylvania; Rhode Island provinces
